{
  "materialName" : "Polyamid",
  "materialClass" : "plastic",
  "component" : [ {
    "aggregateState" : "solid",
    "materialName" : "Polyamid",
    "recycledContent" : -1.7976931348623157E308,
    "materialClass" : "plastic",
    "quantity" : {
      "value" : -1.7976931348623157E308,
      "unit" : "kilogram"
    },
    "materialAbbreviation" : "PA66G40"
  } ],
  "recycledContent" : -1.7976931348623157E308
}